{
  "receiptId": "30000000-0000-4000-8000-000000000002",
  "planId": "30000000-0000-4000-8000-000000000001",
  "hashAlgorithm": "sha256-jcs",
  "planHash": "1c7b640d6aaa659c1d5793ead961b514474a95157c28c2cf30d729e4114fd07b",
  "parameterSchemaHash": "488eb72062fe24778f97bf4909a4887da46f7e9b9a12b4f7422be10e5957a2c3",
  "parameterValuesHash": "9bbba0a3f657c3fee8ed93d6306a376dcab0820ebd809355bdc7ebd4d21960d6",
  "callerSubjectHash": "7960befad07fdd60ae0edea6f19a4f629f5e714526db35421602c9ffcfb10b4e",
  "subjectHashSaltId": "conformance-deployment-v1",
  "delegationChainHash": null,
  "authorizationScopeId": "authorized-assets",
  "policyHash": "bbbbbbbbbbbbbbbbbbbbbbbbbbbbbbbbbbbbbbbbbbbbbbbbbbbbbbbbbbbbbbbb",
  "sourceId": "11111111-1111-4111-8111-111111111111",
  "sourceVersion": "sha256:68fc3e599c5dcb5523a2d65c2d9586bfbec34d8b0dae0660659cf8b965533b13",
  "connectorId": "connectors/tabular-reader-v1",
  "connectorVersion": "1.0.0",
  "connectorCapabilityHash": "ccca6841c2a5d15058240039228b22351d60e6279bdcef5f1b78f687b7114ade",
  "manifestVersion": "manifest-v1",
  "projectionId": "80000000-0000-4000-8000-000000000001",
  "taxonomyVersion": "1.0.0",
  "pipelineVersion": "1.0.0",
  "methodSetHash": "dddddddddddddddddddddddddddddddddddddddddddddddddddddddddddddddd",
  "evidenceCutoff": "2026-01-01T00:09:00Z",
  "revocationEpoch": 0,
  "traceId": "trace-example-1",
  "valid": true,
  "issuedAt": "2026-01-01T00:10:30Z",
  "expiresAt": "2026-01-01T00:15:00Z",
  "reasonCodes": [],
  "estimatedCost": {
    "maximumRows": 10000,
    "maximumBytes": 10485760,
    "maximumDurationMilliseconds": 30000,
    "sourceUnits": 1.0
  },
  "receiptIntegrityHash": "d090e3a04590464da77f383d30c9b9c8eb0823124bf494149031c06943680f7a",
  "issuerKeyId": "conformance-read-plan-v1",
  "signatureAlgorithm": "ed25519",
  "signature": "u8pjIIyB1v3TsSyuO5WgG5h4HtWqwafcORs9qJeydsUcw/lHs7Qjbmj9m1Iq8fH0vbNEEOLD3U/K6rJotsXxCg=="
}
